Content,Category Code
Pakistan today threatened to break off diplomatic relations with Zaire and Costa Rica over their ties with Israel on the eve of a visit here by Palestine Liberation Organization (PLO) Chairman Yasser Arafat.,0
Palestinian leaders said they would boycott all official contact with the United States.,0
"Greece, like most other existing members, plans to impose restrictions on its labour market for new EU members for at least two years from 1 May.",0
"Israel threatened to ban voting in East Jerusalem if Hamas, which advocates Israel’s destruction, ran in the election.",0
Israel’s Cabinet met Sunday and decided to approve a plan that will not allow candidates from the militant group Hamas on the ballots there.,0
President Yoweri Museveni has threatened to ban Ugandan opposition candidates from participating in the upcoming elections.,0
President Laurent Gbagbo announced on Sunday that he will extend the night-time curfew in Algiers in response to recent unrest within the city.,0
President Abdelaziz Bouteflicka threatened to institute a curfew in Algiers in response to recent unrest within the city.,0
Iraq’s interim government announced that it is prepared to impose martial law as street battles raged in central Baghdad between insurgents and security forces.,0
Radical French farmers said on Friday they would blockade Paris from Monday night to demand an end to the European Community’s drastic farm reform.,0
Druze inhabitants of the Syrian Golan Heights threatened today to hold a general strike unless Israel rescinded its annexation of the region within 10 days.,0
"The Soviet Union has threatened to stop negotiations to reduce long-range nuclear weapons if the United States goes ahead with the planned deployment of new medium-range nuclear missiles in Europe, the Washington Post reported today.",0
"The European Community may halt mediation efforts among Yugoslavia’s feuding republics if cooperation by all parties founders, Dutch Foreign Minister Hans Van den Broek said on Tuesday",0
U.N. Secretary-General Kofi Annan announced on Monday that he will withdraw weapons inspectors and humanitarian workers from Iraq.,0
Cairo’s security chief has warned that police will no longer tolerate rallies by the Kifaya (“Enough”) group.,0
"Osama bin Laden’s al-Qaeda terror network has threatened to deliver devastating blows to the United States and Israel, a Saudi-owned weekly reports",0
"NATO confirmed on Wednesday it would tighten the naval blockade of the rump Yugoslav state in the Adriatic with Albania’s help.",0
"Ethnic Albanians have sworn to fight until they gain control of villages near Macedonia’s border with Kosovo, Macedonian officials said Wednesday.",0
The Hamas threatened Monday to resume terrorist activities in Israel in an escalation of the intifada (uprising).,0
Iran today threatened to launch a new military offensive in its Gulf war with Iraq unless Baghdad accepted its conditions for ending the 28-monthold conflict.,0
"Iran threatened to shell Iraqi towns today in retaliation for an air raid on the southern city of Susangerd where, it said, 100 people were killed.",0
"A terror group based in Trinidad claims to be manufacturing chemical and biological weapons to use against the United States and Britain, according to a media report Sunday.",0
Peru has issued an ultimatum to Ecuador to halt attacks across their disputed jungle border.,0
The Homeland Union (Conservatives) began collecting signatures in part of a drive to convince the Lithuanian Parliament to amend the constitution so that same-sex marriages are banned.,0
"Up to 100 ethnic Albanians demonstrated on Tuesday in the Yugoslav province of Kosovo, where 24 people were killed in nationalist riots last March, Belgrade radio said.",0
"Angry activists from the defeated Fatah Party have staged rallies in the Gaza Strip against the party’s leader Mahmoud Abbas, saying he must resign.",0
Tens of thousands of university students throughout Indonesia staged mass demonstrations Saturday to demand political reforms by President Suharto’s government.,0
Thousands of Nigerians from throughout the country were converging Thursday for a rally in Lagos to protest the rights violations under the recently imposed Sharia law by Islamic fundamentalists in the northern districts.,0
"Thousands of Iraqi Kurds demonstrated in the northern city of Kirkuk on Sunday calling for independence from Iraq, witnesses said.",0
"Up to 1,000 ethnic Turks began a hunger strike on Monday to protest against Sweden’s decision to send them back to Bulgaria, where they say they face imprisonment, homelessness and persecution",0
Islamic fundamentalists continued their hunger strike to demand the resignation of Algerian President Ahmed Ben Bella,0
"A member of the Syrian parliament, Mohammed Mamoun, started a hunger strike yesterday to protest President Assad’s failure to usher in meaningful political reforms.",0
"Algerian landowners began a hunger strike outside Parliament to demand the return of property seized by Algerian government forces in the 1970s, APS news agency said.",0
"Salaheddine Sidhoum, Algeria’s leading human rights activist, staged a 24-hour hunger strike in prison on Sunday in protest against the widespread human rights violations by Algerian security forces, his lawyer said on Tuesday.",0
A group of Chenchen refugees are continuing a hunger strike in protest of the Russian government’s refusal to accept the independence of Chechnya.,0
Palestinians of the Israeli-occupied West Bank shunned work on Monday to protest at settlement of Soviet Jewish immigrants on Arab land.,0
"The fundamentalist Umma (Nation) party has said it will boycott Algeria’s first multi-party elections unless the president agrees to step down.",0
"Some 500,000 workers affiliated with the Serbian Workers’ Union (SSS) stopped work on the first day of an open-ended strike on Monday over a controversial employment bill signed in by Serbian Labour Minister Dragan Milovanovic.",0
Seven opposition parties in Nepal have organized a general strike that shut down Khatmandu in protest of last week’s arrest of a number of activists.,0
"Angry French paper workers blocked the Europe Bridge spanning the Rhine from France to West Germany for more than three hours by dumping sawdust on the roadway, French border police said.",0
About 200 supporters of former President Ahmed Ben Bella blocked roads in the capital city of Algiers demanding that he be reinstated as leader of the Algerian government.,0
"Rebels in the Ivory Coast on Tuesday blocked transport into Abidjan as they continued their effort to overthrow the government of President Laurent Gbagbo.",0
"Demonstrators in Baghdad blocked a road to show their disapproval for the United States’ military policies, a newspaper reported Tuesday",0
Young Algerians blocked roads leading to the city centre on Sunday to press their demands for greater freedom and opportunities from President Bouteflika’s government.,0
Hundreds of thousands of people blocked streets in Hong Kong in defiance of Chinese authorities to demand democratic reforms.,0
"Palestinian prisoners rioted Monday at this jail in northern Israel, setting fire to their mattresses and smashing furniture, police sources said.",0
Egyptian demonstrators rioted following a peaceful demonstration calling for the immediate removal of President Hosni Mubarak from office.,0
Palestinian riots against Israeli military policies are still continuing with no end in sight.,0
"Palestinian youths resorted to throwing stones during demonstrations against the alleged human rights violations by the Israeli military, officials said on Thursday.",0
"Prisoners rioted at a jail in East Timor’s capital Dili on Monday joining thousands of demonstrators in demanding a referendum on independence from Indonesian rule, locals said.",0
The Macedonian army prepared to resume shelling Albanian rebel-held territory as attempts to resolve the crisis on the political front were deadlocked.,0
Israeli troops remained on alert in the occupied West Bank today to forestall more violence after a week of unprecedented Palestinian civil unrest.,0
The government of Sindh province has ordered patrols by police and paramilitary soldiers after violent protests by Muslim groups.,0
"Israel has strengthened its forces in Lebanon following the discovery of Soviet-made Katyusha rockets in the area last week, military sources said today.",0
Britain mobilized army reservists for a possible war against Iraq on Tuesday while UN arms inspectors said they needed more time.,0
"North Korea has trained more than 500 computer hackers capable of launching cyber warfare against the United States, South Korea’s defense ministry said Monday. ",0
"Italy announced a suspension of air links with Yugoslavia on Wednesday, one day after a Yugoslav army jet shot down a helicopter carrying EC truce monitors.",0
"A French minister has cancelled a planned visit to Haiti after a state of siege was declared in the one-time French colony, the Foreign Affairs Ministry said on Sunday.",0
"Switzerland said today it had expelled two Soviet diplomats based in Geneva for spying, adding to a long series of espionage scares.",0
The United States announced Wednesday it would prohibit all aid to Albanian rebels in Macedonia and would deny entry to the United States to all individuals undermining stability there.,0
Red Cross officials suspended aid deliveries in Baghdad on Wednesday after two of their vehicles were hit by gunfire and a staff member went missing,0
Japan said on Tuesday it had halted economic aid to Yugoslavia in line with Western efforts to end the fighting there.,0
"The United States suspended part of a military aid program for Bosnia aimed at bringing Bosnian Croat and Moslem armed forces together as a unified identity, the New York Times reported on Friday.",0
"The United Nations on Tuesday reduced food supplies to the biggest Cambodian refugee camp in Thailand because rice was being diverted to outside users, relief officials said.",0
"President Bill Clinton has imposed sanctions on the Taliban religious faction that controls Afghanistan for its support of suspected terrorist Osama bin Laden, the White House said Tuesday.",0
"Palestinians and Israelis failed to reach agreement on the fate of Palestinian offices in east Jerusalem Sunday, despite hours of tense negotiations, sources on both sides reported.",0
Syrian officers today ended mediation efforts between rival militias in Tripoli as shells continued crashing into the north Lebanese port and the death toll rose to more than 200.,0
"Eighty UN peacekeepers were shipped out of the eastern Bosnian enclave of Gorazde Friday, leaving just 100 UN troops to follow them out later this month.",0
"North Korea expelled inspectors of the International Atomic Energy Agency, or IAEA, from frozen nuclear facilities at Yongbyon after U.S. officials alleged that the North admitted it had a uranium-based program in late 2002.",0
"Jakarta forced the UN refugee agency, UNHCR, out of the country following the relief operation, although it had more than £12m of unspent donations.",0
Turkish police prevented the demonstration staged by students at Cumhuriyet University near AKP offices in Sivas on 15 October to protest the decision of sending troops to Iraq.,0
"Croatian authorities are failing to uphold the property rights of Croatian Serb refugees, a human rights group protested here Wednesday",0
"In an unprecedented move, Palestinian police in Jericho confiscated weapons and explosives from Palestinian armed groups, the Israeli army said Friday.",0
"Afghan guerillas blew up three main electric power lines leading into Kabul last month and nearly one third of the city’s power supply is still down, the Czechoslovak news agency Ceteka reported from Kabul today.",0
"Jewish settlers in the West Bank city of Hebron set fire to the offices of the Palestinian administrators of Muslim property overnight following the killing of an Israeli man, Palestinian residents said Sunday.",0
"Israeli army bulldozers demolished Palestinian homes and civilian buildings in southern Gaza on Sunday, Palestinian officials and US witnesses said.",0
The British government on Monday outlawed the largest Protestant extremist organization in Northern Ireland because of what it called its direct involvement in killing in the strife-torn province.,0
"Nicaragua’s Sandinista government today ordered the opposition newspaper La Prensa to suspend publication indefinitely, a spokesman for the paper said.",0
President Yoweri Museveni has banned Ugandan opposition candidates from participating in the upcoming elections.,0
"Turkish authorities have imposed a curfew in the town of Cizre in southeastern Turkey after a demonstration over fraud allegations in Sunday’s local elections, security sources said here Tuesday.",0
"The military government of President Prosper Avril declared a 30-day state of siege in Haiti on Saturday, suspending parts of the constitution and arresting political opponents, a spokeswoman for the U.S. embassy said.",0
"Israeli soldiers arrested more than 100 Palestinians on Saturday in a security sweep of the Hebron area of the occupied West Bank, military sources said.",0
"Ghanaian authorities have deported 168 Liberians for traveling without proper documents on a Swedish-registered vessel, a port official said Monday.",0
Liberian riot police used tear gas to disperse demonstrators protesting election results in Monrovia.,0
"North Korea has tried to hack into the computers of South Korean army officers, officials said Tuesday.",0
"Muslim hackers angered by the publication of cartoons of the Prophet Mohammed have defaced nearly 3,000 Danish Web sites over the past month in the biggest politically motivated cyber attack long-time observers have ever seen.",0
"A temporary camp for Congolese refugees was attacked by Burundian militiamen armed with machetes, killing at least 156 people, the UN refugee agency reported.",0
"Afghan rebels have kidnapped up to 16 Soviet civilian advisers from a town bazaar and exploded a series of bombs in the capital Kabul, western diplomatic sources in neighboring Pakistan said today.",0
"Israeli soldiers routinely beat up Palestinian detainees on the occupied West Bank with the knowledge of senior officers, a court martial was told today.",0
"U.S. border patrol agents sexually abused illegal Mexican immigrants with impunity, a human rights organization charged on Saturday",0
"Security forces in Guinea have tortured scores of Sierra Leonean and Liberian refugees, whom authorities blame for a border conflict, Human Rights Watch (HWR) said Thursday.",0
"A Palestinian prisoner died as a result of torture while in Israeli police custody, according to a report by a pathologist sent to Israel by Physicians for Human Rights.",0
"Irish nationalist guerrillas wounded two British soldiers in a bomb attack on Thursday, police said.",0
"Two Palestinian suicide bombers killed 23 people as well as themselves late Sunday when they blew themselves up in Tel Aviv in the second-worst attack in the current Palestinian uprising, police said.",0
"At least three Iraqi civilians have been killed in a suicide car bombing in central Baghdad, Iraqi police said.",0
A prominent anti-Syria journalist has been killed in a car bomb explosion in a residential sector of mostly Christian eastern Beirut.,0
"A roadside bombing near the town of Samarra on Sunday killed one U.S. soldier and wounded two others, the military said.",0
Three US servicemen were killed by an improvised explosive device outside of the Iraqi city of Basra.,0
"The Sri Lankan army has been holding thousands of Tamil civilian refugees as human shields in the battle zones of the southern sector of the Jaffna peninsula, according to a press release by the Liberation Tigers.",0
"An attempt to assassinate deputy governor of the Tyumen region, Oleg Chemezov, was thwarted in Khanty-Mansiysk (Siberia), the city’s police reported.",0
"Militants loyal to Iraq’s Al-Qaeda frontman Abu Musab al-Zarqawi said they attempted to assassinate outgoing Prime Minister Iyad Allawi, in a statement posted on the internet.",0
Hezbollah guerrillas killed the deputy chief of Israel’s militia ally in southern Lebanon Sunday sources on both sides said.,0
"One Serb policeman was murdered in an attack on a police patrol by Kosovo Albanians near the border with Kosovo, state agency Tanjug reported Sunday.",0
"Vietnamese and Kampuchean forces were battling for control of a strategic base near the border today, Thai military sources said.",0
"Palestinian gunmen attacked an Israeli village close to the West Bank Sunday and killed an Israeli, public television reported.",0
"Israel Friday reimposed blockades in the West Bank following the shooting deaths of two Israelis a day earlier, a military spokesman announced.",0
"The Soviet Union closed its southern borders with Iran and Turkey because of fighting between Azerbaijanis and Armenians, an editor at the official Armenian news agency said.",0
"Vietnamese-led forces have retaken a strategic village in Western Kampuchea after fierce fighting with guerrillas who overran it late last month, Thai military sources said today.",0
"Burmese troops have captured part of a Karen guerrilla stronghold on theThai border after five days of fighting, Thai police here said on Monday.",0
"Israel today mounted its long-threatened invasion of South Lebanon, ploughing through the United Nations lines on the coast of south of Tyre and thrusting forward in at least to inland areas",0
"Sudanese rebels shelled the southern regional capital Juba for the first time in a year on Sunday and Monday, killing about 20 people, relief officials in Nairobi said.",0
"Egyptian police opened fire to disperse Moslem fundamentalist demonstrators on Monday night, killing one person and arresting 12, security sources said.",0
"Serb forces killed three ethnic Albanians in a gunbattle in southeastern Serbia Friday, a political council representing ethnic Albanians in the region said in remarks published here Sunday",0
A minefield explosion near the town of Samarra killed two Iraqi youths and wounded five others on Sunday,0
"Vietnamese-led forces launched artillery, mortar, and rocket fire against Kampuchean guerrilla camps near the eastern Thai border today, killing or wounding 50, Thai military sources said.",0
"Israeli tanks fired four shell bombs at targets in Jericho, witnesses said, in a rare incident in the West Bank city.",0
Soviet aircraft including helicopter gunships killed 46 Afghan civilians in an attack on a village in the western province of Heart.,0
Israeli helicopters and tanks shelled positions of the Palestinian security forces and residential areas near the town of Rafah.,0
British aircraft using precision guided missiles killed 4 Iraqis in an attack on a suspected weapons supply in Basra.,0
"Recent US Predator attacks, occurring about once every three days, have killed at least eight top al-Qaeda leaders since last July, according to Pentagon sources.",0
"Both the Phillippines military and the Moro Islamic Liberation Front are guilty of violating the ceasefire agreement signed in March 2001, according to a group that conducted simultaneous fact-finding missions in Lanao, Maguindanao, and Cotabato provinces last week.",0
"The Israeli army forced out on Wednesday more than 1,000 Palestinian refugees from their homes in a West Bank refugee camp during a 48-hour search for militants, residents said.",0
"Sudan’s government is responsible for mass killings and other atrocities in the Darfur region, according to a United Nations report.",0
"Serb forces were engaged in ethnic cleansing in Kosovo against the majority Albanian population of the province, according to the US government.",0
"Every Christmas Eve, a Lone Choir Boy Sings to More Than 370 Million",1
"Trump Dismisses Resignation of Top ISIS Envoy, Says He Doesn't Even Know Him",0
Indonesia Tsunami Kills More Than 200 Without Warning After Volcanic Eruption,1
"US Treasury Secretary Steven Mnuchin has made calls to the heads of the country's six largest banks, a move to reassure investors after huge falls in US stocks.",1
A Canada goose and a ring-billed gull were recovering after they apparently swallowed random pills left at a park in Southern California,1
Bangladesh deploys soldiers ahead of next Sunday's elections,0
The family of a blind social worker who vanished after traveling to Peru for a wedding held a vigil Sunday night in Michigan to thank her supporters,1
"Arrests in Morocco backpacker beheadings foiled 'terrorist plot,' investigators reveal",0
Der Spiegel to Press Charges Against Reporter Who Made Up Articles,0
"Texas Tent City Housing 2,500 Migrant Children Is Said to Close in January",0
Chris Dawson: Husband in podcast mystery released on bail,0
Two people have been arrested on suspicion of shooting a man dead in north London.,0
"Rand Paul defends Trump plan on Syria, backs similar pullout in Afghanistan; others in GOP remain skeptical",0
Police say investigation into drones over Gatwick ongoing,0
LeBron James apologizes for posting 'Jewish money' rap lyrics,0
"As gender norms become more elastic, drag has burst like a glitter cannon into the mainstream.",2
Watch a Robotic Hand Play the Piano With a More Human Touch,2
President Donald Trump increasingly feels like it's him against the world,2
"Mulvaney: ""Very Possible"" Government Shutdown Will Last Into 2019",2
"Trump Forces Defense Secretary Mattis to Leave by Jan. 1, Will Replace Him With Deputy",1
"Women's March leader claims she was kicked out of progressive group for being Jewish, report says",2
South African musician plays guitar while undergoing brain surgery,2
Seahawks clinch NFC playoff spot with win over Chiefs,1
"Twas about this time in 1980 that several witnesses reported sightings of an unidentified flying object in the vicinity of the Rendlesham Forest in eastern England, an incident that has been called ""Britain's Roswell.""",2
Land mines will be hidden killer in Yemen decades after war,2
The Gatwick Airport drone drama which grounded hundreds of flights will be discussed by ministers in a Christmas Eve conference call.,2
The remains of a horse still in its harness have been discovered at a villa outside the walls of Pompeii,1
Police say investigation into drones over Gatwick ongoing,0
French prime minister defends police targeted by protesters,0
"In South Africa, ousted president speaks his mind on Twitter",0
Fast food workers reveal most annoying customer habits,2
"During the presidential campaign, the outlier in Donald Trump's foreign-policy orations was his treatment of Iran",0
"Florida prepares to register former felons to vote, despite confusion over rules",2
Former NFL All-Pro running back Jamal Anderson was arrested Sunday after an incident with a limo driver in Georgia.,0
A late hit on Chicago Bears quarterback Mitchell Trubisky sparked a brawl on the sideline in the fourth quarter during a game against the San Francisco 49ers on Sunday.,1
Two Houston police officers suffered serious injuries and burns after crashing into two parked cars late Sunday evening,1
"Bigger discounts than normal are expected in the traditional Boxing Day sales, as shops try to make up for weak trading in the lead-up to Christmas.",1
Royal Bank of Scotland has applied for a German banking licence to help it retain clients in the European Union in the event of a no-deal Brexit.,0
9 New Books We Recommend This Week,2
"As gender norms become more elastic, drag has burst like a glitter cannon into the mainstream.",2
"Calm on the surface, the Evros River between Turkey and Greece runs wild underneath, roiling with currents that tear apart boats and swallow up swimmers.",2
10 Gifts for People Who've Made the News This Year,2
A number of recent news articles have brought renewed attention to financial conflicts of interest in medical science.,2
"Hearing Loss Threatens Mind, Life and Limb",2
"Comedian Louis C.K., who admitted to repeatedly exposing himself and masturbating in front of unwilling women in Nov. of 2017, said at the time he was going to ""step back and take a long time to listen.""",0
here has been a wave of criticism after Philippines President Rodrigo Duterte said he sexually assaulted a maid when he was a teenager.,2
Republicans used to shut down the government in the name of fiscal restraint.,2
"Between breaking news developments, 2018 has marked out a number of momentous anniversaries.",2
The Media's Post-Advertising Future Is Also Its Past,2
"Robin Thicke, Maria Menounos and more to turn out for Fox's 'New Year's Eve With Steve Harvey: Live From Times Square'",2
Romania slams EU for treating it as 'second-rate' country,0
Philippines president jokes about sex assault during speech,1
C.I.A.'s Afghan Forces Leave a Trail of Abuse and Anger,1
"In Orange County, a Republican Fortress Turns Democratic",1
"Letitia James, the incoming New York attorney general, has made no secret of how she feels about President Trump.",0
More than a million revelers are expected to celebrate New Year's in Times Square.,1
"In millions of households across the country, on New Year's Eve all eyes are on New York City where hundreds of thousands gather to watch a bejeweled, illuminated ball make its slow descent to mark the new year.",2
"N.Y. Today: A Party With 3,000 Pounds of Confetti, 1 Ball and Too Many People to Count",2
"From petty grifting to allegations of treason, the early Trump era has offered a survey course in how to diminish public faith in democratic institutions.",2
The Most Distant Place We've Visited,2
Is There Any Humane Way to Kill a Mouse?,2
American Is Arrested in Moscow on Spying Charges,0
