Content,Category Code
NATO on Monday declined to comment on an estimate that Yugoslav army and special police troops in Kosovo were losing 90 to 100 dead per day in NATO air strikes.,0
Former West Germany Chancellor Willy Brandt said in a radio interview broadcast today he was skeptical over Moscow’s will to agree on limiting European-based nuclear weapons.,0
"Israeli Prime Minister Ehud Barak said Friday he was very pessimistic about the chances of resuming peace talks with Syria, Israel radio reported.",0
Turkish President Turgut Ozal said on Wednesday he was confident that the United States would remove irritants damaging relations between the two NATO allies.,0
The European Community said on Thursday it hoped the lifting of martial law in Beijing would lead to an improvement in human rights.,0
"Europe’s leading security forum is exploring the possibility of international patrols to monitor the former Yugoslav republic of Macedonia’s border with Serbia, its envoy said on Friday.",0
"Malaysia is considering giving money to 20,000 Vietnamese boat people in the country to entice them to return home, foreign minister said on Tuesday.",0
A Damascus-based Palestinian guerrilla group claimed responsibility on Saturday for attacks on Israeli troops from Jordan in the past two days.,0
The government of Liberia denied on Thursday charges by Ivory Coast that Monrovia is committing genocide.,0
"South Korea on Friday rejected as “totally baseless” accusations by Amnesty International that it had carried out mass arrests of political prisoners, but church human rights groups here supported the accusations.",0
Secretary-General Boutros Boutros-Ghali on Saturday expressed condolences to the United States for the death of three American diplomats.,0
President Reagan and Egyptian President Hosni Mubarak agreed today there was an urgent need for progress towards a Middle East settlement and that a freeze on Israeli settlements in occupied territories was also needed.,0
"Kenyan President Daniel Arap Moi on Monday urged Uganda to to repatriate “all Kenyan criminals hiding there” to face trial, accusing them of killing Kenyan policemen in cross-border raids recently.",0
"Outspoken Serbian ultra-nationalist leader Vojislav Seselj called on Arab countries to join forces against a possible US-led attack on Iraq, Tanjug news agency reported Wednesday.",0
Indian business leaders Friday called for greater impetus towards free trade despite mounting tensions between India and Pakistan.,0
"South Korea has requested to lease a Russian military training ground, military officers in Seoul said on Thursday.",0
"Turkey renewed an appeal to Belgium to extradite a far-left militant wanted for murder, Justice Minister Cemil Cicek said Thursday, slamming what he called lax international cooperation against terrorism.",0
Turkey said Monday it had asked Tehran and Damascus to provide urgent information about arms and ammunition seized last week in southeastern Turkey aboard six trucks travelling from Iran to Syria.,0
North Korean state media have called on the United States to forge “ties of confidence” with Pyongyang ahead of six-party nuclear talks expected to be held in Beijing on July 26.,0
"Charles Taylor called on Liberians to stand by him during these difficult days, “Soon this bad wind shall pass,” he moaned.",0
"Lebanese President Amin Gemayel has asked President Reagan for full United States support for Lebanon’s cause, the White House said today.",0
"Romania has asked the European Community for immediate delivery of additional aid, EC sources said on Thursday.",0
Russia and China will ask Asian banks to help finance construction of an $8 billion Trans-Siberian natural gas link to China.,0
"Angola has asked Portugal for military aid, especially instructors for its Soviet- and Cuban-trained armed forces, a Lisbon newspaper said today.",0
Oxfam Canada today called on the world community to help save tens of thousands of Afghan civilians threatened with starvation.,0
A group of prominent Liberians have written to President George Bush urging him to send U.S. peacekeeping troops to their capital Monrovia.,0
"About 300 representatives from Egyptian civil society organizations submitted the most recent in a series of reform petitions, under the title “In Defense of the Nation” to the Saudi royal family.",0
European ministers had called for Burma to institute reforms before joining the ASEAN.,0
Members of parliament from Kenya’s Liberal Democratic Party called on Energy Minister Kiraitu Murungi to resign in the wake of new evidence over Energy Minister Kiraitu Murungi to resign in the wake of new evidence over,0
The UN Security Council has called on Haiti’s interim government to hold elections by 7 February.,0
U.S. President George W. Bush said Friday that he will tell Japanese Prime Minister Junichiro Koizumi that Japan needs to enact significant economic reforms.,0
"Carl Bildt called for three urgent reforms in Swedish politics—tax reform, business reform and welfare reform—and stressed the creation of new jobs as the principal task for the future.",0
"The UN urged the Maoists rebels in Nepal to honor human rights, according to the UN High Commissioner for Human Rights (UNHCR).",0
The international committee of the Lebanese Living Abroad movement is contacting a number of Lebanese legislatures to propose a new addendum incorporating the right to vote abroad into the electoral law adopted for the upcoming parliamentary elections.,0
President Emile Lahoud has pushed the Lebanese Parliament for a new election law two days before he is to call parliamentary elections.,0
Scandal-plagued President Gloria Macapagal Arroyo on Monday urged Congress in the Philippines to change the constitution to shift to a parliamentary form of government to ease the country’s constant political instability.,0
"Israeli Prime Minister Ariel Sharon wants Germany to pay more compensation to the families of 11 Israeli athletes killed at the 1972 Munich Olympic Games, a statement from his office said Tuesday.",0
Dozens of journalists at Sudan’s most respected daily newspaper appealed to the Sudanese government on Wednesday to let them resume publishing and compensate them for lost wages.,0
"Human Rights Watch also called on Yemen, Algeria andMalaysia to immediately lift bans on newspapers closed in recent days for printing the caricatures.",0
"Islamic fundamentalist leaders appealed to their Muslim followers for an end to anti-government agitation, authorities said Monday.",0
The United States called on Israel to move forward with its “courageous and historic” disengagement plan as fast as possible.,0
"Iraq on Saturday appealed to the U.N. to bring an end to their trade embargo, which it said is causing huge shortages of medicine and food",0
An international aid agency appealed to the Sudanese government on Friday to urgently reconsider its ban on relief flights to southern Sudan.,0
The presidents of Iraq and Egypt called on Tuesday for the withdrawal of Syrian and other foreign forces from Lebanon to end 14 years of civil war there.,0
Leaders of the 16-member Economic Community of West African States (ECOWAS) called on Wednesday for an immediate ceasefire in war-torn Liberia.,0
El Salvador on Monday requested an urgent Security Council meeting on Wednesday to deal with what it called violations by Nicaragua of the Central American peace accords,0
"The Russian Foreign Minister Sergei Lavrov said here Saturday that he urges Iran and the EU trio (France, Germany, and Britain) to reach an agreement in their talks on Iran’s nuclear program.",0
The International Crisis Group has called on the UN stabilization mission in Haiti to broker an agreement among Haitians that “establishes common objectives for the next government.”,0
Senior Hungarian and Romanian officials agreed on Wednesday that their countries should cooperate to encourage Romanian refugees in Hungary to return home.,0
"The Asia-Pacific Economic Cooperation (APEC) forum has agreed to set up an energy research center in Tokyo to further develop its regional energy projections, officials said Thursday.",0
"The United States and Jordan have agreed upon a new free-trade pact between the two countries, the White House announced Tuesday.",0
"Jordan and Britain have agreed to undertake joint military exercises this month, a Jordanian official confirmed.",0
"Libya has offered to hand over to an Arab country two of its nationals suspected by the West of blowing up a Pan Am plane in 1988, a state-owned Egyptian newspaper said.",0
"Israel and the Palestinians reached a consensus to exchange information on water resources on the second day of a multilateral conference on water problems in the Middle East here Thursday, the meeting’s co-chairman said.",0
"The Turkish-Cypriot and Greek-Cypriot sides of this divided Mediterranean island have agreed to share information Friday on missing people from both communities, a UN official said on Monday.",0
"Portugal will support Turkey’s efforts to become a full member of the European Community, Portuguese President Mario Soares said on Tuesday.",0
Hungary has said it will support a U.N. Security Council resolution that aims to tighten sanctions and impose a naval blockade against neighboring Yugoslavia.,0
"NATO-member Norway is willing to send material to help defend Saudi Arabia if it is attacked, Norway’s foreign minister said.",0
"Finland will give Tanzania a grant of 580 million shillings (64.45 million dollars) over the next three years to finance several projects in the country, a statement issued by the ministry of finance said today",0
European Community foreign ministers agreed in principle on Saturday to provide about 70 million dollars of aid for Romania and Poland.,0
British Defence Secretary Tom King has promised to continue military aid to war-torn Mozambique.,0
Syria has again offered its troops to Lebanon’s new President Elias Hrawi to help him oust General Michel Aoun from the Christian enclave Aoun controls.,0
"The United Nations will provide nearly 25,000 tons of emergency food aid to refugees fleeing the civil war in Liberia, the World Food Program (WFP) said on Monday.",0
"France is ready to contribute up to 4,000 troops to an international peacekeeping force in Yugoslavia, Defence Minister Pierre Joxe said on Monday",0
The Security Council today agreed to a six-month extension of the mandate for the peacekeeping force in Lebanon (UNIFIL) despite Israel’s wish for a shorter period.,0
"Ousted President Askar Akayev has agreed to resign without returning to the Kyrgyzstan, the Parliament speaker said Saturday.",0
"Planning and Investment Minister Tran Xuan Gia said Vietnam is committed to opening up the economy but will not be rushed, in a rare interview late on Friday.",0
"Turkey will allow up to 13,000 Turkish Kurd refugees who have lived in Iraq for more than a decade to return home as part of a UN-brokered deal.",0
Serbian President Vojislav Kostunica promised to democratize Serbia and establish the rule of law as he succeeded Milosevic.,0
"A Soviet official offered concessions last November that U.S. negotiator Paul Nitze believed could lead to an agreement on reducing nuclear missiles in Europe, according to a senator who acted as a go-between at the talks.",0
"In an interview this weekend, President Abdelaziz Bouteflika said he is prepared to lift ban on Islamic Salvation Front (FIS) but not with its historical leadership.",0
Leaders of the Azadliq (Freedom) opposition coalition agreed to postpone the demonstration in Baku until 9 November.,0
"The Fijian rebels said they will release Prime Minister Mahendra Chaudhry and more than 30 members of his government, whom they had taken hostage two weeks ago, on the weekend.",0
"The rebel Revolutionary United Front (RUF) announced it will return weapons and military equipment seized last year from United Nations peacekeepers, according to reports reaching here from the country’s capital Freetown.",0
"Under the disengagement plan, Isreal will evacuate all 21 settlements in the Gaza Strip in mid-August, said spokesperson for the Israeli prime minister.",0
"The US Congress agreed to lift embargoes on pharmaceutical sales in late February to Iran, Libya, North Korea, Sudan, and with strings attached, Cuba.",0
"Ethopia has agreed to re-open its borders to UN peackeepers, who are depolyed in the region to oversee a ceasefire between Ethiopia and its neighbor, Eritrea.",0
"In a letter handed over to the United Nations on Monday, Iraq said it would allow the return of U.N. weapons inspectors “without conditions” to “remove any doubts Iraq still possesses weapons of mass destruction.”",0
"With the signing of a Memorandum of Understanding (MOU) on Cessation of Hostilities, the Sudanese government and SPLM/A have agreed to allow “unimpeded humanitarian access to all areas and for people in need.”",0
Yugoslavia and Slovenia agreed to a ceasefire after two days of fierce fighting but media reports said sporadic clashes were still continuing.,0
"Shefket Musliu said on 21 May in Konculj, in the Federal Republic of Yugoslavia, that his forces will lay down their weapons and disband by the end of the month because “the time has come. . . to seek changes through political means,” AP reported.",0
"Syria says it is willing to withdraw its troops from neighboring Lebanon, after fifteen years of effective military occupation.",0
"East German Foreign Minister Oskar Fischer will visit Albania in June, the first Warsaw Pact foreign minister to do so since Tirana split with Moscow in 1961, the Albanian embassy said.",0
"On September 29, Putin offered to negotiate with Chechen President Aslan Maskhadov following the invasions of Dagestan.",0
"Denmark today accepted a formula for ending its fisheries dispute with its European common market partners, government officials said.",0
Afghan rebel leaders said on Wednesday they would meet U.N. mediator Diego Cordovez if he gave them a veto over any settlement reached in peace talks.,0
"Israeli Prime Minister Ehud Barak has agreed to US mediation in the final status talks with the Palestinians, a senior Israeli official said.",0
"Gambian President Dawda Jawara will visit Mauritania and Senegal to mediate in a border dispute between the two West African neighbors, diplomatic sources said on Wednesday.",0
King Hassan of Morocco was quoted today as saying he would be ready to host a meeting between an Israeli peace movement and the Palestine Liberation Organization (PLO).,0
A group of African diplomats held their first meeting with President Parvanov at a lunch hosted by the Ambassador of Kingdom of Morocco.,0
"U.S. Secretary of State Warren Christopher telephoned Russian Foreign Minister Andrei Kozyrev on Tuesday to discuss efforts to forge a peace settlement in former Yugoslavia, Itar-Tass news agency said.",0
"Taiwan’s Vice Foreign Minister visited Russia today, becoming the island’s highest ranking government official to go there.",0
Iraqi President Saddam Hussein arrived in Amman on a previously unannounced visit on Wednesday.,0
Russian President Boris Yeltsin on Saturday hosted Japanese Prime Minister Ryutaro Hashimoto in this Siberian city for an informal meeting aimed at establishing close personal relations between the two leaders.,0
President Francois Mitterand gave a warm welcome on Thursday to South African leader F.W. de Klerk who is attempting to break his country’s international isolation.,0
"U.S. and Soviet negotiators return to Geneva this week for talk on limiting the number of European-based nuclear missiles, an issue likely to dominate East-West relations this year.",0
Arab League Secretary General Chadli Klibi undertook mediation mission between Syria and Palestinian leader Yasser Arafat.,0
"Quatar’s emir, Sheikh Hamad bin Khalifa al-Thani launched a mediation effort on Saturday between the Emirates and Saudi Arabia whose ties have been strained by Riyadh’s new friendship with Tehran.",0
Israel and Lebanon renewed negotiations today on an Israeli troop pullback from Lebanon and their future relations.,0
"French National Assembly president Laurent Fabius and a group of deputies held talks with leaders of Romania’s new government on Tuesday, the first high level Western delegation to visit Bucharest since last month’s revolution.",0
"Czechoslovakia and Albania have upgraded their diplomatic ties back up to ambassadorial level after an 18-year break, the official CTK news agency said on Wednesday",0
A top U.S. official today praised Haiti’s efforts to improve its record on human rights and said it was an important partner for the United States.,0
The West German government today welcomed President Reagan’s latest policy statement as proof of Washington’s earnest wish for a settlement to be reached in U.S.-Soviet nuclear talks.,0
"The United States on Thursday defended the right of Soviet troops to fire protectively on militants in Azerbaijan and insisted unrest there reflected age-old ethnic tensions, not a fight for political independence.",0
Palestinian leader Yasser Arafat defended Iraq and Libya on Friday against Western criticism of their arms industries and said the West was applying double standards on human rights.,0
"Arab League Secretary-General Chedli Klibi today urged the European Community to support the Palestinian Liberation Organization (PLO), which he said would create a favorable climate for peace talks.",0
"Saudi Arabia has mobilized pressure groups in the United States to help support the rights of Palestinians in their struggle against Israel, a top minister said in comments published Thursday.",0
"Sri Lanka has established diplomatic ties with and opened an embassy in Tehran, the foreign ministry said on Wednesday.",0
"Argentina has apologized to Brazil for one of its gunboats intercepting a Brazilian ship in the Beagle Channel, disputed by Argentina and Chile.",0
A group of Yoruba leaders announced yesterday that they are willing to forgive President Olusegun Obasanjo and queue behind him for a second term.,0
"Libyan leader Muammar Gaddafi and Bulgarian President Todor Zhivkov today signed a treaty of friendship and cooperation, the BTA reported",0
"Czechoslovakia and China signed an agreement today to increase trade in 1983 by 50 percent compared with last year, the official Czechoslovak news agency Ceteka said today.",0
Taliban ruled Afghanistan has been sharing expertise with the Liberation Tigers of Tamil Eelam according to a special report submitted to the Canadian Security Intelligence Service.,0
"European foreign direct investment flows in Latin America and the Caribbean rose more than eightfold during the second half of the 1990s compared with the first half of that decade, according to a study presented in Paris by the Inter-American Development Bank.",0
"French and Egyptian warships on Monday launched 10 days of war games in the Mediterranean Sea, expected to be joined later by Italian and German vessels, the French embassy said Monday.",0
"Zambia extradited suspected British militant Haroon Rashid Aswad to Britain on Sunday, a senior Zambian government official said.",0
"Israeli intelligence officials have shared evidence with the U.S. about contacts between al Qaeda and senior members of Saddam Hussein’s Ba’ath Party, according to governmental officials.",0
"Doctors from two American aid groups donated and personally delivered $50,000 worth of goods to Baghdad University Medical School, risking as much as 12 years in prison and $500,000 in fines.",0
The European Community on Monday gave the Ivory Coast 5.1 million dollars of aid for agricultural development projects.,0
"The United States continued to send arms to Pakistan last year, a State Department Spokesman said Wednesday.",0
"The United States is providing aerial photographs and other military intelligence to Macedonia which is preparing a major offensive against ethnic Albanian guerrillas, the Washington Post said Wednesday.",0
"Swiss doctors handed over 700 kg of medicine to the Red Crescent in Bam, Iran, according to the Swiss Agency for Development and Cooperation.",0
"Benin opened its borders today to most West Africans ordered out of Nigeria as illegal aliens, but was still refusing admittance to Ghanaians, by far the biggest group involved, Benin police said.",0
U.N. helicopters evacuated the wounded from the besieged Bosnian town of Gorazde on Friday.,0
"The first deployment of NATO peacekeeping troops have arrived in Bosnia, Defense Secretary William Perry said.",0
"A first patch of Bangladeshi peacekeeping troops arrived in Sierra Leone Tuesday, joining 12 unarmed military observers as the first element of an 800-strong Bangladeshi contingent due here, U.N. officials said.",0
"Peru has granted diplomatic asylum to five Panamanian army officers holed up in a diplomatic residence since last month’s U.S. invasion, the Peruvian embassy said on Tuesday.",0
"Uganda has granted political asylum to 18 Zairean rebels who entered the country illegally two years ago and are wanted at home on treason charges, a United Nations official said on Friday",0
"Uganda said on Sunday it had paid compensation to 67 elderly British nationals, most of the Asians, for assets they lost when former dictator Idi Amin expelled them 18 years ago.",0
"President Omar Hassan al-Bashir, following the partial peace deal, has taken several tentative steps to enhance political freedoms and promote an image of openness and tolerance in Sudan.",0
The Latvian Constitutional Court cancelled restrictions on the use of the Russian language on national radio and television.,0
The Ivory Coast’s Supreme Court decided to allow candidate Alassane Ouattara to participate in the country’s upcoming elections.,0
Yugoslavia lifted a night curfew in Kosovo where 28 people have been killed in ethnic riots this year and the province was reported quiet on Sunday.,0
President Omar El Bashir on Thursday shortened by one hour the nightly curfew imposed in Sudan after a June 30 coup toppled the civilian government.,0
"Yugoslavia eased emergency measures on Wednesday in Kosovo province, the scene of ethnic violence last March, as authorities in Croatia cracked down on Serbian nationalists.",0
"Sudan’s government on Sunday lifted a state of emergency in West Darfur State that was imposed six months ago after bloody tribal clashes there, Omdurman radio reported Sunday.",0
"The Nigerian Union of Teachers (NUT), the umbrella union for primary school teachers, announced Thursday that it has called off a four-day strike after deliberations with the Nigerian government.",0
The Rwandan government on Thursday accepted demands from Hutu rebels that it initiate political reforms.,0
"Tuesday the Serbian parliament approved a “special law” recognizing victories by Zoran Djindjic’s opposition coalition in November 17 municipal elections in 14 of the 18 most important Serbian cities, including Belgrade.",0
Georgian President Eduard Shevardnadze resigned Sunday as the opposition threatened to storm his residence in Tbilisi.,0
"As part of its fight to eradicate poverty, the governing Labour Party has introduced a legally-binding minimum rate of pay in Britain for the first time.",0
"The Federal Minister for Interior Aftab Ahmad Khan Sherpao allowed opposition leader Maulana Fazl-ur-Rehman to bring out ‘Shan-e-Mustafa (SAW)’ Rally after an agreement on carrying out a violence free protest demonstration, according to the Pakistani Federal Secretary Interior.",0
President Dos Sontas has reportedly conceded at last to demands from National Union for the Total Independence of Angola (UNITA) to overhaul the judiciary.,0
Lt. Gen. Prosper Avril resigned yesterday to allow Haiti’s first democratic elections to take place.,0
"According to a zoo spokesperson Malaysian authorities have initiated the process of returning the four baby gorillas to Nigeria, amid speculations they were illegally captured in the wild.",0
"Polish police today released the correspondent of the American news agency United Press International, who was detained for 23 hours and questioned in connection with an inquiry into alleged illegal activities. ",0
"Bosnian Serb forces Tuesday let free six French UN peacekeepers held captive inside a UN armored personnel carrier since Friday, a UN spokesman said.",0
"French maritime authorities today release an impounded ship operated by the Greenpeace ecology movement, port officials said.",0
An Egyptian court released a Lebanese millionaire’s assets of nearly 19 million dollars on Saturday six years after they were frozen in a major bank scandal.,0
"Germany on Wednesday lifted sanctions against gold from South Africa in recognition of the country’s moves to abolish apartheid, a government spokesman said.",0
"The United Arab Emirates (UAE) has lifted its boycott of trade in oil on Namibia, effective since March 31.",0
"The European Union failed Wednesday to renew sanctions against Zimbabwe, with the fate of an EU-Africa summit scheduled for April hanging in the balance.",0
"Kyrgyz Prime Minister Nikolai Tanaev received a mission of observers from the OSCE, informing them in detail on the economic situation of the country.",0
"A first patch of Bangladeshi peacekeeping troops arrived in Sierra Leone Tuesday, joining 12 unarmed military observers as the first element of an 800-strong Bangladeshi contingent due here, U.N. officials said.",0
The IAEA has dispatched inspectors to Esfahan Uranium Conversion Facilities (UCF) in central Iran to monitor resumption of peaceful nuclear work at the plant.,0
Humanitarian access for the Darfur region has improved significantly since September as the Khartoum government tried to secure international favor.,0
